{
  "schema_version": "1.0.0",
  "package_id": "compile-presets-e0-exemplo-publico-v2",
  "project_id": "projeto-demonstracao",
  "created_at": "2026-08-24T13:30:00-03:00",
  "compiler_revision": "1.0.0",
  "sources": {
    "base_request": {
      "path": "config/exemplo_pedido_e0_dataset_atual.json",
      "sha256": "7fde570dcca9e60a905303dc009a70db76e1800b498ff8e49454a2876030ee30"
    },
    "preset_selection": {
      "path": "config/selecao_presets_e0_dataset_atual.json",
      "sha256": "ce61b7fecec5c7205e3177cd86a1e1e8adfd915a1d74fce39490bc92689f406c"
    },
    "preset_resolution": {
      "path": "config/exemplo_resolucao_presets_e0.json",
      "sha256": "cf52a80046439b1199a7c12c34afdd2e17a0b872231524dfb8e070aa4d271172"
    },
    "parameter_catalog": {
      "path": "config/catalogo_parametros_projeto.json",
      "sha256": "a9cdc3153ec43e5f9e2929262fec0e0c9c7dc0509943b90101555dfac3b31377"
    },
    "request_schema": {
      "path": "schemas/project-generation-request.schema.json",
      "sha256": "1e2b1d15cfa5d4e2b5141bb1e586dcca100d908e9fabca0be15b5a02f2c6ac47"
    },
    "acquisition_catalog": {
      "path": "config/catalogo_aquisicao_insumos.json",
      "sha256": "c270024bcfdb4368132e39eb65370fda1ad4cb9ec47e34d4780d01c0f15363c0"
    },
    "reference_model_catalog": {
      "path": "config/catalogo_modelos_reais_cana.json",
      "sha256": "1e153a974417ccdf403437ba7eb674b891cb1349383354be2418ded29a1465dd"
    },
    "preset_catalog": {
      "path": "config/catalogo_presets_sistema.json",
      "sha256": "48b1efc4df006c1df2b12c43d24f5e5436b37cddad044e5a5bfcdf0c8606cc0a"
    }
  },
  "policy": {
    "parameter_merge": "BASE_REQUEST_AUTHORITATIVE",
    "system_e0_materialization": "E0_ASSUMPTION_AND_OPTIMIZER_ONLY",
    "custom_value_materialization": "BASE_REQUEST_WITH_FULL_PROVENANCE_ONLY",
    "reference_materialization": "NEVER",
    "unresolved_evidence_materialization": "NEVER",
    "conflict_policy": "KEEP_BASE_AND_REPORT"
  },
  "output": {
    "request_path": "dataset/derived/pedido_compilado_presets_e0_dataset_atual.json",
    "manifest_path": "dataset/derived/preset_request_compilation_manifest.json",
    "request_id": "e0-exemplo-publico-presets-v1",
    "created_at": "2026-08-24T13:30:00-03:00"
  }
}
